{
  "id": "coreyhaines31/marketingskills",
  "repoUrl": "https://github.com/coreyhaines31/marketingskills",
  "allowedPaths": ["skills/**/SKILL.md"],
  "pinPolicy": "sha",
  "licensePolicy": "record-and-review",
  "hiddenByDefault": true,
  "visibility": "catalog-only",
  "defaultStudio": "marketing"
}
